{
  "vector_id": "WEXP-CORE-00-V0007",
  "specification": {
    "document": "draft-sergeev-wexp-core",
    "revision": "00",
    "artifact": "xml",
    "sha256": "6cd8b680059cc81e1ec4c84737d9319ee242ef63e89c57de497bd57ede08d810"
  },
  "requirement_ids": ["WEXP-CORE-00-REQ-0005"],
  "purpose": "Confirm that an unknown critical extension fails closed before semantic level evaluation.",
  "classification": "negative",
  "test_representation": {
    "id": "wexp-core-00-test-harness",
    "revision": "1",
    "status": "non-normative-test-representation"
  },
  "input": {
    "prior_checks": {
      "structure": "valid",
      "canonicalization": "valid",
      "timestamps": "valid",
      "signature": "valid",
      "key_binding": "valid",
      "capabilities_resolution": "accepted",
      "hash_algorithms": "supported",
      "recorder_qualification": "absent",
      "chain": "absent"
    },
    "boundary_type": "proxy",
    "claimed_level": "WL2",
    "effective_conformance_class": "CC2",
    "evidence": {
      "arguments_hash": true,
      "execution_fields": false,
      "bound_provenance": false,
      "bound_independent_verification": false
    },
    "unknown_extensions": [
      {
        "name": "slice-unknown",
        "critical": true
      }
    ]
  },
  "expected": {
    "verdict": "reject",
    "errors": ["E_UNKNOWN_CRITICAL_EXTENSION"]
  },
  "derivation": {
    "source_locators": [
      "Section 8.1 (XML anchor verifier-result), normative ordered checks",
      "Section 8.3 (XML anchor verifier-failure), unknown critical content"
    ],
    "steps": [
      "The extension is explicitly unknown and marked critical.",
      "Core requires fail-closed rejection before boundary or level evaluation.",
      "The required error is E_UNKNOWN_CRITICAL_EXTENSION.",
      "No verified level is asserted for the rejected input."
    ]
  }
}
