{
  "vector_id": "WEXP-CORE-00-V0001",
  "specification": {
    "document": "draft-sergeev-wexp-core",
    "revision": "00",
    "artifact": "xml",
    "sha256": "6cd8b680059cc81e1ec4c84737d9319ee242ef63e89c57de497bd57ede08d810"
  },
  "requirement_ids": [
    "WEXP-CORE-00-REQ-0001",
    "WEXP-CORE-00-REQ-0002",
    "WEXP-CORE-00-REQ-0006"
  ],
  "purpose": "Confirm that a record declaring the proxy boundary and carrying the required arguments commitment supports a WL2 claim under the stated trusted harness preconditions.",
  "classification": "positive",
  "test_representation": {
    "id": "wexp-core-00-test-harness",
    "revision": "1",
    "status": "non-normative-test-representation"
  },
  "input": {
    "prior_checks": {
      "structure": "valid",
      "canonicalization": "valid",
      "timestamps": "valid",
      "signature": "valid",
      "key_binding": "valid",
      "capabilities_resolution": "accepted",
      "hash_algorithms": "supported",
      "recorder_qualification": "absent",
      "chain": "absent"
    },
    "boundary_type": "proxy",
    "claimed_level": "WL2",
    "effective_conformance_class": "CC2",
    "evidence": {
      "arguments_hash": true,
      "execution_fields": false,
      "bound_provenance": false,
      "bound_independent_verification": false
    },
    "unknown_extensions": []
  },
  "expected": {
    "verdict": "accept",
    "verified_level": "WL2"
  },
  "derivation": {
    "source_locators": [
      "Section 6.1 (XML anchor fields-conditional), WL2",
      "Section 7.1 (XML anchor honesty-boundary), attainable pseudocode",
      "Section 11.1 (XML anchor iana-boundary-types), proxy registry entry",
      "Section 4.1.1 (XML anchor cc-maxcap), Table 3",
      "Section 8.1 (XML anchor verifier-result), normative base and verdict calculation"
    ],
    "steps": [
      "The proxy boundary grounds WL2.",
      "The arguments hash satisfies the WL1 and WL2 conditional field requirement.",
      "attainable is WL2 and maxCapability(CC2) is WL2.",
      "verified_level equals the claimed WL2, so the verdict is accept."
    ]
  }
}
