{
  "vector_id": "WEXP-CORE-00-V0004",
  "specification": {
    "document": "draft-sergeev-wexp-core",
    "revision": "00",
    "artifact": "xml",
    "sha256": "6cd8b680059cc81e1ec4c84737d9319ee242ef63e89c57de497bd57ede08d810"
  },
  "requirement_ids": [
    "WEXP-CORE-00-REQ-0002",
    "WEXP-CORE-00-REQ-0003",
    "WEXP-CORE-00-REQ-0006"
  ],
  "purpose": "Confirm that independent-verification evidence does not substitute for provenance in a WL4 claim.",
  "classification": "negative",
  "test_representation": {
    "id": "wexp-core-00-test-harness",
    "revision": "1",
    "status": "non-normative-test-representation"
  },
  "input": {
    "prior_checks": {
      "structure": "valid",
      "canonicalization": "valid",
      "timestamps": "valid",
      "signature": "valid",
      "key_binding": "valid",
      "capabilities_resolution": "accepted",
      "hash_algorithms": "supported",
      "recorder_qualification": "absent",
      "chain": "absent"
    },
    "boundary_type": "host-hook",
    "claimed_level": "WL4",
    "effective_conformance_class": "CC5",
    "evidence": {
      "arguments_hash": true,
      "execution_fields": true,
      "bound_provenance": false,
      "bound_independent_verification": true
    },
    "unknown_extensions": []
  },
  "expected": {
    "verdict": "downgrade",
    "verified_level": "WL3"
  },
  "derivation": {
    "source_locators": [
      "Section 7.1 (XML anchor honesty-boundary), type-specific evidence lift",
      "Section 8.2.1 (XML anchor verifier-downgrade), explicit claimed-WL4 example",
      "Section 4.1.1 (XML anchor cc-maxcap), Table 3",
      "Section 8.1 (XML anchor verifier-result), normative base and verdict calculation"
    ],
    "steps": [
      "The host-hook boundary and execution fields support the WL3 base.",
      "The claim is WL4, whose lift requires bound provenance.",
      "The bound independent-verification artifact satisfies WL5 only and cannot substitute for provenance or assign a level above the claim.",
      "attainable is WL3, so the verdict is downgrade with verified_level WL3."
    ]
  }
}
