{
  "vector_id": "WEXP-CORE-00-V0003",
  "specification": {
    "document": "draft-sergeev-wexp-core",
    "revision": "00",
    "artifact": "xml",
    "sha256": "6cd8b680059cc81e1ec4c84737d9319ee242ef63e89c57de497bd57ede08d810"
  },
  "requirement_ids": [
    "WEXP-CORE-00-REQ-0002",
    "WEXP-CORE-00-REQ-0003",
    "WEXP-CORE-00-REQ-0006"
  ],
  "purpose": "Confirm that an effective CC3 capability ceiling prevents an otherwise attainable WL4 claim.",
  "classification": "boundary",
  "test_representation": {
    "id": "wexp-core-00-test-harness",
    "revision": "1",
    "status": "non-normative-test-representation"
  },
  "input": {
    "prior_checks": {
      "structure": "valid",
      "canonicalization": "valid",
      "timestamps": "valid",
      "signature": "valid",
      "key_binding": "valid",
      "capabilities_resolution": "accepted",
      "hash_algorithms": "supported",
      "recorder_qualification": "absent",
      "chain": "absent"
    },
    "boundary_type": "host-hook",
    "claimed_level": "WL4",
    "effective_conformance_class": "CC3",
    "evidence": {
      "arguments_hash": true,
      "execution_fields": true,
      "bound_provenance": true,
      "bound_independent_verification": false
    },
    "unknown_extensions": []
  },
  "expected": {
    "verdict": "downgrade",
    "verified_level": "WL3"
  },
  "derivation": {
    "source_locators": [
      "Section 4.1.1 (XML anchor cc-maxcap), Table 3",
      "Section 7.1 (XML anchor honesty-boundary), evidence lift and combined invariant",
      "Section 8.1 (XML anchor verifier-result), normative base calculation"
    ],
    "steps": [
      "The host-hook boundary, complete execution fields, and bound provenance make WL4 attainable.",
      "maxCapability(CC3) is WL3.",
      "The combined minimum is WL3.",
      "verified_level is below the WL4 claim, so the verdict is downgrade."
    ]
  }
}
