{
  "vector_id": "WEXP-CORE-00-V0002",
  "specification": {
    "document": "draft-sergeev-wexp-core",
    "revision": "00",
    "artifact": "xml",
    "sha256": "6cd8b680059cc81e1ec4c84737d9319ee242ef63e89c57de497bd57ede08d810"
  },
  "requirement_ids": [
    "WEXP-CORE-00-REQ-0001",
    "WEXP-CORE-00-REQ-0002",
    "WEXP-CORE-00-REQ-0006"
  ],
  "purpose": "Confirm that a manual-approval boundary cannot support an invocation-level claim.",
  "classification": "boundary",
  "test_representation": {
    "id": "wexp-core-00-test-harness",
    "revision": "1",
    "status": "non-normative-test-representation"
  },
  "input": {
    "prior_checks": {
      "structure": "valid",
      "canonicalization": "valid",
      "timestamps": "valid",
      "signature": "valid",
      "key_binding": "valid",
      "capabilities_resolution": "accepted",
      "hash_algorithms": "supported",
      "recorder_qualification": "absent",
      "chain": "absent"
    },
    "boundary_type": "manual-approval",
    "claimed_level": "WL2",
    "effective_conformance_class": "CC2",
    "evidence": {
      "arguments_hash": true,
      "execution_fields": false,
      "bound_provenance": false,
      "bound_independent_verification": false
    },
    "unknown_extensions": []
  },
  "expected": {
    "verdict": "downgrade",
    "verified_level": "WL1"
  },
  "derivation": {
    "source_locators": [
      "Section 7.1 (XML anchor honesty-boundary), base execution level and combined invariant",
      "Section 11.1 (XML anchor iana-boundary-types), manual-approval registry entry",
      "Section 4.1.1 (XML anchor cc-maxcap), Table 3",
      "Section 8.1 (XML anchor verifier-result), normative base and verdict calculation"
    ],
    "steps": [
      "The manual-approval boundary grounds only WL1.",
      "The arguments hash satisfies the conditional field at WL1, but the boundary cannot ground WL2.",
      "attainable is WL1 while maxCapability(CC2) is WL2.",
      "verified_level is WL1 below the WL2 claim, so the verdict is downgrade."
    ]
  }
}
